<?xml version="1.0" encoding="UTF-8"?>
<domain
    xmlns:xsi="http://www.w3.org/2001/XMLSchema-instance"
    xsi:noNamespaceSchemaLocation="../../../php-dns-server.xsd"
>
    <name>example.com.</name>
    <default-ttl>7200</default-ttl>

    <resource-records>
        <resource-record>
            <name>@</name>
            <ttl>10800</ttl>
            <type>SOA</type>
            <class>IN</class>
            <rdata>
                <mname>example.com.</mname>
                <rname>postmaster</rname>
                <serial>2</serial>
                <refresh>3600</refresh>
                <retry>7200</retry>
                <expire>10800</expire>
                <minimum>3600</minimum>
            </rdata>
        </resource-record>

        <resource-record>
            <type>A</type>
            <rdata>
                <address>12.34.56.78</address>
            </rdata>
        </resource-record>

        <resource-record>
            <type>A</type>
            <rdata>
                <address>90.12.34.56</address>
            </rdata>
        </resource-record>

        <resource-record>
            <type>AAAA</type>
            <rdata>
                <address>2001:acad:ad::32</address>
            </rdata>
        </resource-record>

        <resource-record>
            <name>www</name>
            <type>cname</type>
            <rdata>
                <target>@</target>
            </rdata>
        </resource-record>

        <resource-record>
            <name>ldap</name>
            <type>A</type>
            <rdata>
                <address>192.168.3.89</address>
            </rdata>
        </resource-record>

        <resource-record>
            <name>@</name>
            <type>MX</type>
            <rdata>
                <preference>15</preference>
                <exchange>mail</exchange>
            </rdata>
        </resource-record>

        <resource-record>
            <name>*.subdomain</name>
            <type>A</type>
            <rdata>
                <address>192.168.1.42</address>
            </rdata>
        </resource-record>

        <resource-record>
            <name>_ldap._tcp</name>
            <type>SRV</type>
            <rdata>
                <priority>1</priority>
                <weight>5</weight>
                <port>389</port>
                <target>ldap</target>
            </rdata>
        </resource-record>
    </resource-records>
</domain>
