<?xml version="1.0" encoding="UTF-8"?>
<domain
        xmlns:xsi="http://www.w3.org/2001/XMLSchema-instance"
        xsi:noNamespaceSchemaLocation="../../../php-dns-server.xsd"
>
    <name>test2.com.</name>
    <default-ttl>300</default-ttl>

    <resource-records>
        <resource-record>
            <name>@</name>
            <ttl>10800</ttl>
            <type>SOA</type>
            <class>IN</class>
            <rdata>
                <mname>ns1</mname>
                <rname>admin</rname>
                <serial>2014111100</serial>
                <refresh>1800</refresh>
                <retry>7200</retry>
                <expire>8600</expire>
                <minimum>300</minimum>
            </rdata>
        </resource-record>

        <resource-record>
            <type>A</type>
            <rdata>
                <address>111.111.111.111</address>
            </rdata>
        </resource-record>

        <resource-record>
            <type>A</type>
            <rdata>
                <address>112.112.112.112</address>
            </rdata>
        </resource-record>

        <resource-record>
            <type>MX</type>
            <rdata>
                <preference>20</preference>
                <exchange>mail-gw1</exchange>
            </rdata>
        </resource-record>

        <resource-record>
            <type>MX</type>
            <rdata>
                <preference>30</preference>
                <exchange>mail-gw2</exchange>
            </rdata>
        </resource-record>

        <resource-record>
            <type>TXT</type>
            <rdata>
                <text>Some text.</text>
            </rdata>
        </resource-record>
    </resource-records>
</domain>